{
  "$schema": "https://json-schema.org/draft/2020-12/schema",
  "$id": "https://voxmana.io/schemas/card-voice-relationships.source.schema.json",
  "title": "Vox Mana card-voice relationship authority",
  "type": "object",
  "required": ["schema_version", "authority", "review_policy", "records"],
  "properties": {
    "schema_version": { "const": "1.0.0" },
    "authority": { "type": "string", "minLength": 1 },
    "review_policy": { "type": "string", "minLength": 1 },
    "records": {
      "type": "array",
      "items": {
        "type": "object",
        "required": ["relationship_id", "identity_key", "canonical_card_name", "canonical_card_id", "exact_excerpt", "relationship_class", "certified_identity_claim_ids", "canonical_card_data_locator", "relationship_bridge", "false_positive_analysis", "adjacent_identity_confusion_risk", "review_status", "approval_basis", "validation"],
        "properties": {
          "review_status": { "const": "APPROVED_PUBLIC" },
          "approval_basis": { "const": "EVIDENCE_VALIDATED_AUTOMATIC" },
          "relationship_class": { "enum": ["EXPLICIT_IDENTITY_REFERENCE", "NATIVE_FIGURE_OR_LOCATION", "CERTIFIED_SEMANTIC_ECHO"] },
          "certified_identity_claim_ids": { "type": "array", "minItems": 1, "uniqueItems": true },
          "validation": { "type": "object", "required": ["validator_version", "passed", "failures"], "properties": { "passed": { "const": true } } }
        },
        "additionalProperties": true
      }
    }
  },
  "additionalProperties": false
}
