{
  "schema_version": "1.0.0",
  "authority": "Certified Vox Mana identity claims plus exact committed canonical card flavor text and a validated bounded relationship bridge.",
  "review_policy": "APPROVED_PUBLIC only after evidence validation; generic thematic analogy is rejected.",
  "records": [
    {
      "relationship_id": "cardvoice_wu_27e04c41_f42c_4d60_8a71_ec2d7c326f64",
      "identity_key": "WU",
      "identity_name": "Azorius Senate",
      "canonical_card_name": "Azorius Cluestone",
      "canonical_card_id": "27e04c41-f42c-4d60-8a71-ec2d7c326f64",
      "scryfall_id": "09eeb301-bc28-4515-ad69-0b1b5164a5bc",
      "exact_excerpt": "Its three sides represent the Sova, judges and arbitrators; the Jelenn, scribes and elocutors; and the Lyev, lawmages and enforcers.",
      "printing": {
        "scryfall_id": "09eeb301-bc28-4515-ad69-0b1b5164a5bc",
        "oracle_id": "27e04c41-f42c-4d60-8a71-ec2d7c326f64",
        "set": "dgm",
        "collector_number": "136",
        "flavor_text_field": "card.flavor_text",
        "source_locator": "https://api.scryfall.com/cards/09eeb301-bc28-4515-ad69-0b1b5164a5bc#card.flavor_text"
      },
      "relationship_class": "EXPLICIT_IDENTITY_REFERENCE",
      "certified_identity_claim_ids": [
        "azorius_senate_claim_001",
        "azorius_senate_claim_002",
        "azorius_senate_claim_003",
        "azorius_senate_claim_007"
      ],
      "source_ids": [
        "src_wotc_flavorful_guide_ravnica_allegiance_2019",
        "src_wotc_ravnica_allegiance_mechanics_2018",
        "src_mark_rosewater_slow_and_steady_2006"
      ],
      "source_locators": [
        {
          "source_id": "src_wotc_flavorful_guide_ravnica_allegiance_2019",
          "locator": "A Flavorful Guide to the Guilds of Ravnica Allegiance - Azorius Senate section"
        },
        {
          "source_id": "src_wotc_ravnica_allegiance_mechanics_2018",
          "locator": "Ravnica Allegiance Mechanics - Addendum section"
        },
        {
          "source_id": "src_mark_rosewater_slow_and_steady_2006",
          "locator": "Slow and Steady - WHAT DOES THE GUILD CARE ABOUT? WHAT IS ITS END GOAL? WHAT MEANS DOES THE GUILD USE TO ACHIEVE THESE ENDS?"
        }
      ],
      "supporting_official_locators": [],
      "canonical_card_data_locator": "data/dossier/card-voice-printings.source.json#identity_key=WU",
      "why_voice_belongs": "Azorius Cluestone's exact excerpt provides a bounded voice echo of Azorius named directly through its judges, scribes, and lawmages.",
      "relationship_bridge": "The excerpt is admissible for owner review only because its language corresponds to certified claims azorius_senate_claim_001, azorius_senate_claim_002, azorius_senate_claim_003, azorius_senate_claim_007; the relationship does not arise from card color, product membership, tags, or mechanics.",
      "false_positive_analysis": "White, Blue, and Esper also use systems and records; the explicit civic/legal institution makes this Azorius.",
      "adjacent_identity_confusion_risk": "White, Blue, and Esper also use systems and records; the explicit civic/legal institution makes this Azorius.",
      "limitation": "Exact card text is verified, but Public use is limited to this validated voice relationship. White, Blue, and Esper also use systems and records; the explicit civic/legal institution makes this Azorius.",
      "review_status": "APPROVED_PUBLIC",
      "approval_basis": "EVIDENCE_VALIDATED_AUTOMATIC",
      "validation": {
        "validator_version": "vm551-evidence-validator-v1",
        "passed": true,
        "failures": [],
        "approval_basis": "EVIDENCE_VALIDATED_AUTOMATIC",
        "evidence_chain": {
          "identity_claim_ids": [
            "azorius_senate_claim_001",
            "azorius_senate_claim_002",
            "azorius_senate_claim_003",
            "azorius_senate_claim_007"
          ],
          "identity_source_locators": [
            "data/raw-factions/azorius_senate/azorius_senate.claims.json#azorius_senate_claim_001",
            "data/raw-factions/azorius_senate/azorius_senate.claims.json#azorius_senate_claim_002",
            "data/raw-factions/azorius_senate/azorius_senate.claims.json#azorius_senate_claim_003",
            "data/raw-factions/azorius_senate/azorius_senate.claims.json#azorius_senate_claim_007"
          ],
          "fact_source_locators": [
            "data/dossier/card-voice-printings.source.json#identity_key=WU"
          ]
        }
      },
      "display_priority": 1,
      "critical_repeat": {
        "allowed": false,
        "reason": "Page-level usage planning should prefer a distinct card for each teaching role."
      }
    },
    {
      "relationship_id": "cardvoice_ub_c9edddb4_0d60_4d21_8887_51d943c6a31f",
      "identity_key": "UB",
      "identity_name": "House Dimir",
      "canonical_card_name": "Consult the Necrosages",
      "canonical_card_id": "c9edddb4-0d60-4d21-8887-51d943c6a31f",
      "scryfall_id": "6f51484b-3bad-4332-87f8-61924e153799",
      "exact_excerpt": "Dimir rank and file never see nor hear their guildmaster. All orders are given through mysterious necrosages who appear from the shadows, tersely toss out a command, and then melt into the darkness.",
      "printing": {
        "scryfall_id": "6f51484b-3bad-4332-87f8-61924e153799",
        "oracle_id": "c9edddb4-0d60-4d21-8887-51d943c6a31f",
        "set": "rav",
        "collector_number": "199",
        "flavor_text_field": "card.flavor_text",
        "source_locator": "https://api.scryfall.com/cards/6f51484b-3bad-4332-87f8-61924e153799#card.flavor_text"
      },
      "relationship_class": "EXPLICIT_IDENTITY_REFERENCE",
      "certified_identity_claim_ids": [
        "house_dimir_claim_0017",
        "house_dimir_claim_0018",
        "house_dimir_claim_0019"
      ],
      "source_ids": [
        "src_wotc_flavorful_guide_guilds_ravnica_2018",
        "src_wotc_guilds_ravnica_mechanics_2018"
      ],
      "source_locators": [
        {
          "source_id": "src_wotc_flavorful_guide_guilds_ravnica_2018",
          "locator": "A Flavorful Guide to the Guilds of Ravnica - House Dimir reviewed source record"
        },
        {
          "source_id": "src_wotc_guilds_ravnica_mechanics_2018",
          "locator": "Guilds of Ravnica Mechanics - Dimir and surveil reviewed source record"
        }
      ],
      "supporting_official_locators": [],
      "canonical_card_data_locator": "data/dossier/card-voice-printings.source.json#identity_key=UB",
      "why_voice_belongs": "Consult the Necrosages's exact excerpt provides a bounded voice echo of Dimir named directly through unseen hierarchy and orders delivered by mysterious intermediaries.",
      "relationship_bridge": "The excerpt is admissible for owner review only because its language corresponds to certified claims house_dimir_claim_0017, house_dimir_claim_0018, house_dimir_claim_0019; the relationship does not arise from card color, product membership, tags, or mechanics.",
      "false_positive_analysis": "Azorius and Orzhov also use hierarchy, while Blue/Black use information; the hidden backroom delivery is the Dimir distinction.",
      "adjacent_identity_confusion_risk": "Azorius and Orzhov also use hierarchy, while Blue/Black use information; the hidden backroom delivery is the Dimir distinction.",
      "limitation": "Exact card text is verified, but Public use is limited to this validated voice relationship. Azorius and Orzhov also use hierarchy, while Blue/Black use information; the hidden backroom delivery is the Dimir distinction.",
      "review_status": "APPROVED_PUBLIC",
      "approval_basis": "EVIDENCE_VALIDATED_AUTOMATIC",
      "validation": {
        "validator_version": "vm551-evidence-validator-v1",
        "passed": true,
        "failures": [],
        "approval_basis": "EVIDENCE_VALIDATED_AUTOMATIC",
        "evidence_chain": {
          "identity_claim_ids": [
            "house_dimir_claim_0017",
            "house_dimir_claim_0018",
            "house_dimir_claim_0019"
          ],
          "identity_source_locators": [
            "data/raw-factions/house_dimir/house_dimir.claims.json#house_dimir_claim_0017",
            "data/raw-factions/house_dimir/house_dimir.claims.json#house_dimir_claim_0018",
            "data/raw-factions/house_dimir/house_dimir.claims.json#house_dimir_claim_0019"
          ],
          "fact_source_locators": [
            "data/dossier/card-voice-printings.source.json#identity_key=UB"
          ]
        }
      },
      "display_priority": 1,
      "critical_repeat": {
        "allowed": false,
        "reason": "Page-level usage planning should prefer a distinct card for each teaching role."
      }
    },
    {
      "relationship_id": "cardvoice_br_3f806353_592e_431c_a7dd_a4c64034f94d",
      "identity_key": "BR",
      "identity_name": "Cult of Rakdos",
      "canonical_card_name": "Avatar of Discord",
      "canonical_card_id": "3f806353-592e-431c-a7dd-a4c64034f94d",
      "scryfall_id": "adf2a1fd-eb1e-46aa-b715-6e6fb5195e42",
      "exact_excerpt": "Such is the power of Rakdos that even his shadow takes on a cruel life of its own.",
      "printing": {
        "scryfall_id": "adf2a1fd-eb1e-46aa-b715-6e6fb5195e42",
        "oracle_id": "3f806353-592e-431c-a7dd-a4c64034f94d",
        "set": "arc",
        "collector_number": "79",
        "flavor_text_field": "card.flavor_text",
        "source_locator": "https://api.scryfall.com/cards/adf2a1fd-eb1e-46aa-b715-6e6fb5195e42#card.flavor_text"
      },
      "relationship_class": "EXPLICIT_IDENTITY_REFERENCE",
      "certified_identity_claim_ids": [
        "cult_of_rakdos_claim_001",
        "cult_of_rakdos_claim_002",
        "cult_of_rakdos_claim_006"
      ],
      "source_ids": [
        "src_wotc_flavorful_guide_ravnica_allegiance_2019",
        "src_wotc_ravnica_allegiance_mechanics_2018"
      ],
      "source_locators": [
        {